<?xml version="1.0" encoding="UTF-8"?>
<?xml-stylesheet type="text/xsl" href="transform.xsl"?>
<!DOCTYPE books SYSTEM "books.dtd">
<books xmlns:xsi="http://www.w3.org/2001/XMLSchema-instance" xsi:noNamespaceSchemaLocation="books.xsd">
    <book>
        <title>1984 (Signet Classics)</title>
        <theme1>Magic</theme1>
        <theme2>Fantesy</theme2>
        <readingLvl>Intermediate</readingLvl>
    </book>
    <book>
        <title>Adventures of Huckleberry Finn</title>
        <theme1>Magic</theme1>
        <theme2>Real</theme2>
        <readingLvl>Beginner</readingLvl>
    </book>
</books>